{
  "$schema": "./authority-v1.schema.json",
  "schema_version": "cigar.configuration-authority.v1",
  "platform_scope": {
    "operating_system": "macos",
    "architectures": [
      "aarch64"
    ],
    "status": "development_only"
  },
  "precedence_order": [
    "compiled_default",
    "system_config",
    "user_config",
    "project_config",
    "explicit_config",
    "environment",
    "cli_flag",
    "programmatic_api"
  ],
  "profiles": [
    {
      "id": "embedded",
      "owner": "embedding application + cigar-sdk-rust + cigar-daemon",
      "configuration_boundary": "programmatic builder plus one explicit daemon configuration",
      "project_configuration": "forbidden_for_sdk_and_daemon; CLI project layer is setting-scoped",
      "network_authority": "forbidden",
      "secret_authority": "descriptor-bound file or explicit provider handle",
      "mode_invariants": [
        "no HTTP endpoint",
        "no remote authorization",
        "daemon mode must be local",
        "storage, policy, and identity are explicit"
      ]
    },
    {
      "id": "local_sidecar",
      "owner": "cigar-cli + cigard",
      "configuration_boundary": "layered CLI resolution plus one explicit daemon configuration",
      "project_configuration": "allowed only where setting.project_configuration_forbidden is false",
      "network_authority": "Unix socket preferred; authenticated loopback TCP ingress; optional disabled-by-default stock HTTPS effect egress uses explicit public IP pins",
      "secret_authority": "descriptor-bound owner-only file",
      "mode_invariants": [
        "exactly one local transport",
        "public bind forbidden",
        "TLS/OIDC/shared storage forbidden",
        "live HTTPS effects disabled unless one strict registry connector and scoped credential boundary are explicit"
      ]
    },
    {
      "id": "remote_client",
      "owner": "application + CIGAR SDK or cigar-cli",
      "configuration_boundary": "programmatic SDK builder or layered CLI resolution",
      "project_configuration": "allowed only for non-secret CLI settings",
      "network_authority": "one HTTPS origin without userinfo, path, query, fragment, redirect, or ambient proxy",
      "secret_authority": "explicit provider handle or descriptor-bound owner-only file",
      "mode_invariants": [
        "HTTPS required except explicit loopback development opt-in",
        "local IPC fields forbidden",
        "ambient credentials forbidden"
      ]
    },
    {
      "id": "shared_service",
      "owner": "cigard operator",
      "configuration_boundary": "one explicit strict daemon configuration",
      "project_configuration": "forbidden",
      "network_authority": "explicit TLS/OIDC/PostgreSQL/S3 origins; ambient proxy inheritance forbidden",
      "secret_authority": "descriptor-bound owner-only or immutable files",
      "mode_invariants": [
        "TLS, OIDC, PostgreSQL, and object storage required",
        "local IPC and local bearer token forbidden",
        "runtime and migrator identities distinct"
      ]
    }
  ],
  "ambient_authority": {
    "disposition": "ignored_or_rejected_never_inherited",
    "proxy_environment": [
      "HTTP_PROXY",
      "http_proxy",
      "HTTPS_PROXY",
      "https_proxy",
      "ALL_PROXY",
      "all_proxy",
      "NO_PROXY",
      "no_proxy"
    ],
    "credential_environment": [
      "AWS_ACCESS_KEY_ID",
      "AWS_SECRET_ACCESS_KEY",
      "AWS_SESSION_TOKEN",
      "AWS_PROFILE",
      "AWS_WEB_IDENTITY_TOKEN_FILE",
      "AWS_CONTAINER_CREDENTIALS_FULL_URI",
      "AWS_CONTAINER_CREDENTIALS_RELATIVE_URI",
      "GOOGLE_APPLICATION_CREDENTIALS",
      "AZURE_CLIENT_SECRET",
      "CIGAR_AUTHORIZATION",
      "CIGAR_TOKEN"
    ],
    "filesystem_conventions": [
      "$HOME/.netrc",
      "ambient cloud-provider profiles"
    ],
    "transport_requirements": [
      "redirects disabled",
      "referer disabled where supported",
      "default proxy discovery disabled",
      "credentials supplied only by explicit provider or file handle",
      "stock effect egress uses explicit public address pins and no ambient DNS"
    ]
  },
  "file_policies": [
    {
      "id": "configuration",
      "owner": "effective uid or root",
      "mode": "not group/world writable",
      "links": "regular non-symlink with link count one",
      "size": "bounded",
      "read_binding": "descriptor-relative no-follow walk for every ancestor and final component; lstat/open/fstat/read/fstat/final-lstat identity and stability checked"
    },
    {
      "id": "trusted_handle",
      "owner": "effective uid or root",
      "mode": "not group/world writable",
      "links": "regular non-symlink with link count one",
      "size": "bounded nonempty",
      "read_binding": "descriptor-relative no-follow walk for every ancestor and final component; descriptor-bound through parse/use"
    },
    {
      "id": "secret_handle",
      "owner": "effective uid",
      "mode": "no group/world permissions",
      "links": "regular non-symlink with link count one",
      "size": "bounded nonempty",
      "read_binding": "descriptor-relative no-follow walk for every ancestor and final component; descriptor-bound through use; provenance redacted"
    },
    {
      "id": "immutable_secret_handle",
      "owner": "effective uid",
      "mode": "0400 exactly",
      "links": "regular non-symlink with link count one",
      "size": "bounded nonempty",
      "read_binding": "descriptor-relative no-follow walk for every ancestor and final component; descriptor-bound through use; shared keystore decoded from validated bytes"
    }
  ],
  "source_inventories": [
    {
      "path": "crates/cigar-cli/src/configuration.rs",
      "struct": "ConfigurationLayer",
      "setting_prefix": "cli"
    },
    {
      "path": "crates/cigar-daemon/src/config.rs",
      "struct": "DaemonConfig",
      "setting_prefix": "daemon"
    },
    {
      "path": "crates/cigar-daemon/src/config.rs",
      "struct": "WorkerCapacities",
      "setting_prefix": "daemon.workers"
    },
    {
      "path": "crates/cigar-daemon/src/config.rs",
      "struct": "ApplicationResourceLimits",
      "setting_prefix": "daemon.resources"
    },
    {
      "path": "crates/cigar-daemon/src/config.rs",
      "struct": "TelemetrySettings",
      "setting_prefix": "daemon.telemetry"
    },
    {
      "path": "crates/cigar-daemon/src/config.rs",
      "struct": "TlsFiles",
      "setting_prefix": "daemon.tls"
    },
    {
      "path": "crates/cigar-daemon/src/config.rs",
      "struct": "OidcSettings",
      "setting_prefix": "daemon.oidc"
    },
    {
      "path": "crates/cigar-daemon/src/config.rs",
      "struct": "ProductionPaths",
      "setting_prefix": "daemon.production"
    },
    {
      "path": "crates/cigar-daemon/src/production_effects.rs",
      "struct": "ProductionHttpsEffectTransportConfiguration",
      "setting_prefix": "daemon.production.effect_connector.https_transport"
    },
    {
      "path": "crates/cigar-daemon/src/config.rs",
      "struct": "LocalVectorSettings",
      "setting_prefix": "daemon.local_vector"
    },
    {
      "path": "crates/cigar-daemon/src/config.rs",
      "struct": "SharedStorageSettings",
      "setting_prefix": "daemon.shared_storage"
    },
    {
      "path": "crates/cigar-daemon/src/config.rs",
      "struct": "SharedPostgresSettings",
      "setting_prefix": "daemon.shared_storage.postgres"
    },
    {
      "path": "crates/cigar-daemon/src/config.rs",
      "struct": "SharedObjectSettings",
      "setting_prefix": "daemon.shared_storage.object"
    },
    {
      "path": "sdk/rust/src/embedded.rs",
      "struct": "EmbeddedClientBuilder",
      "setting_prefix": "sdk.embedded"
    },
    {
      "path": "sdk/rust/src/remote.rs",
      "struct": "RemoteClientBuilder",
      "setting_prefix": "sdk.remote"
    }
  ],
  "settings": [
    {
      "id": "cli.schema_version",
      "owner": "cigar-cli",
      "profiles": [
        "embedded",
        "local_sidecar",
        "remote_client"
      ],
      "precedence": [
        "compiled_default",
        "system_config",
        "user_config",
        "project_config",
        "explicit_config",
        "environment"
      ],
      "allowed_sources": [
        "compiled_default",
        "system_config",
        "user_config",
        "project_config",
        "explicit_config",
        "environment"
      ],
      "default_semantics": "compiled_v1",
      "required_semantics": "required_for_file_layers",
      "secret_classification": "non_secret",
      "value_form": "typed_value",
      "provenance_label": "schema_version",
      "project_configuration_forbidden": false,
      "macos_disposition": "active"
    },
    {
      "id": "cli.target",
      "owner": "cigar-cli",
      "profiles": [
        "embedded",
        "local_sidecar",
        "remote_client"
      ],
      "precedence": [
        "compiled_default",
        "system_config",
        "user_config",
        "project_config",
        "explicit_config",
        "environment",
        "cli_flag"
      ],
      "allowed_sources": [
        "compiled_default",
        "system_config",
        "user_config",
        "project_config",
        "explicit_config",
        "environment",
        "cli_flag"
      ],
      "default_semantics": "compiled_local",
      "required_semantics": "required_after_resolution",
      "secret_classification": "non_secret",
      "value_form": "typed_value",
      "provenance_label": "target",
      "project_configuration_forbidden": false,
      "macos_disposition": "active"
    },
    {
      "id": "cli.local_socket",
      "owner": "cigar-cli",
      "profiles": [
        "local_sidecar"
      ],
      "precedence": [
        "compiled_default",
        "system_config",
        "user_config",
        "project_config",
        "explicit_config",
        "environment"
      ],
      "allowed_sources": [
        "compiled_default",